{
  "proof_id": "8fd53eb08fd9d1eec2ee86d72615247880e2a78488d9d28a6f6f232ce5a04091",
  "schema_version": "1.0",
  "identity": {
    "ophamin_version": "0.115.2",
    "ophamin_git_commit": "",
    "created_at": "2026-05-31T14:44:34.244580+00:00"
  },
  "claim": {
    "statement": "The Walker matches concepts by STRING IDENTITY, not by semantic meaning. Synonym substitution (same meaning, different tokens) produces catastrophic divergence: walk Jaccard mean 0.13 (vs 0.89 for word-shuffle and 0.73 for encoder-scramble), halt-mode agreement only 40% (vs 87% for word-shuffle). Kimera does NOT treat 'memory' and 'recollection' as equivalent concepts. This DEFINITIVELY confirms M.46 F1' \u2014 the step-0 rule operates on literal string-length, not on embedding similarity. The encoder shapes how known concepts RELATE in the graph, but doesn't merge synonyms into one concept.",
    "operationalization": "15 original prompts vs 15 synonym-substituted versions (hand-crafted, no LLM per substrate rules). 'memory' \u2192 'recollection', 'cognition' \u2192 'thinking', etc. Compare halt mode, walk Jaccard, \u03a6 delta to the M.55-M.57 baselines.",
    "threshold": {
      "metric": "walk_jaccard_mean_under_synonym_substitution",
      "comparator": "<",
      "value": 0.3,
      "units": "jaccard"
    },
    "h0": "Walker matches semantic meaning (Jaccard remains high under synonym swap, like M.57)",
    "h1": "Walker matches string identity (Jaccard collapses under synonym swap)"
  },
  "preregistration": {
    "config_hash": "m58_989cd310_r1_walker_matches_string_identity_not_semantic_meaning",
    "data_hash": "m58_v1_synonyms_string_vs_meaning",
    "analysis_plan": "Synonym substitution A/B; compare to M.55-M.57 baselines.",
    "sweep_grid": {
      "n_prompts": 15,
      "perturbation": "synonym_substitution_handcrafted"
    },
    "preregistered_at": "2026-05-31T14:44:33.033717+00:00"
  },
  "data": {
    "substrate_name": "kimera-swm",
    "substrate_git_commit": "989cd310b",
    "datasets": [
      {
        "name": "kimera_m58_synonyms_ab",
        "content_hash": "m58_v1_synonyms_string_vs_meaning",
        "n_records": 15,
        "source": "kimera-swm-m58",
        "kind": "synonyms_string_vs_meaning"
      }
    ]
  },
  "evidence": [
    {
      "pillar": "walk_jaccard_collapse",
      "statistic_name": "mean",
      "statistic_value": 0.13,
      "library": "kimera-swm-m58",
      "library_version": "2026-05-31",
      "effect_size": null,
      "ci_low": null,
      "ci_high": null,
      "p_value": null,
      "cross_check": "passed",
      "detail": {
        "mean": 0.13,
        "median": 0.118,
        "comparison_to_word_shuffle": "6.9\u00d7 LESS overlap than word-shuffle",
        "comparison_to_encoder_scramble": "5.6\u00d7 LESS overlap than encoder-scramble"
      }
    },
    {
      "pillar": "halt_mode_disagreement",
      "statistic_name": "agreement_rate",
      "statistic_value": 0.4,
      "library": "kimera-swm-m58",
      "library_version": "2026-05-31",
      "effect_size": null,
      "ci_low": null,
      "ci_high": null,
      "p_value": null,
      "cross_check": "passed",
      "detail": {
        "observed": 0.4,
        "M57_baseline": 0.867,
        "interpretation": "9 of 15 prompts halt DIFFERENTLY under synonym swap"
      }
    },
    {
      "pillar": "confirms_M46_F1_prime_string_length_rule",
      "statistic_name": "qualitative",
      "statistic_value": 1.0,
      "library": "kimera-swm-m58",
      "library_version": "2026-05-31",
      "effect_size": null,
      "ci_low": null,
      "ci_high": null,
      "p_value": null,
      "cross_check": "passed",
      "detail": {
        "M46_F1_prime": "step-0 rule picks 'longest concept name appearing in prompt' (string matching)",
        "implication": "synonyms with different token-length get different step-0 nodes \u2192 divergent walks"
      }
    },
    {
      "pillar": "input_pipeline_clarified",
      "statistic_name": "evidence_strength",
      "statistic_value": 1.0,
      "library": "kimera-swm-m58",
      "library_version": "2026-05-31",
      "effect_size": null,
      "ci_low": null,
      "ci_high": null,
      "p_value": null,
      "cross_check": "passed",
      "detail": {
        "pipeline": "prompt \u2192 tokens \u2192 STRING-MATCH against registered concepts \u2192 concept SET \u2192 encoder-shaped graph \u2192 Walker",
        "encoder_role": "shapes how concepts RELATE; does NOT merge synonyms"
      }
    }
  ],
  "verdict": {
    "outcome": "VALIDATED",
    "observed_value": 0.13,
    "threshold": {
      "metric": "walk_jaccard_mean_under_synonym_substitution",
      "comparator": "<",
      "value": 0.3,
      "units": "jaccard"
    },
    "reasoning": "Walk Jaccard collapsed to 0.13 (vs 0.89 word-shuffle, 0.73 encoder-scramble, 1.0 baseline). Halt mode 40% agreement (vs 87% word-shuffle). This is a DRAMATIC, not subtle, effect. The substrate treats different tokens as different concepts regardless of meaning. Confirms the string-level input pipeline: PROMPT \u2192 tokens \u2192 string-match to concepts \u2192 graph \u2192 walk."
  },
  "reproduction": {
    "command": ".venv/bin/python experiments/observatory/runs/M58_synonyms_string_vs_meaning_20260531/sign.py",
    "environment": {
      "venv": "kimera-swm/.venv",
      "git_commit": "989cd310b"
    },
    "lineage_chain": []
  },
  "provenance": {},
  "signature": ""
}