{
  "proof_id": "7ebb706cbf4b753f2d2d3908469357a4582f03b3afa38cfdf7b57d41061e8c1f",
  "schema_version": "1.0",
  "identity": {
    "ophamin_version": "0.115.2",
    "ophamin_git_commit": "",
    "created_at": "2026-05-31T12:39:04.517192+00:00"
  },
  "claim": {
    "statement": "M.53 M2 (the architectural claim that 'the encoder is the single most load-bearing lever in the substrate's reasoning architecture; swapping it modifies every downstream step') is EMPIRICALLY PARTIAL REFUTED by M.56. Per-concept dimension-shuffled encoder produces substantial divergence (walks differ ~25%, phi delta 7\u00d7 baseline noise) but NOT catastrophic divergence (80% halt-mode agreement, 73% mean walk-Jaccard preserved). The substrate has a concept-set-driven stratum that survives encoder geometry perturbations \u2014 likely the Walker step-0 rule (M.46 F1' \u2014 picks longest prompt-matching concept on string-length, encoder-independent) plus concept-extraction operating on tokens rather than embeddings.",
    "operationalization": "15 diverse prompts run through two fresh Takwin instances:\n  A: default encoder (KimeraCooccurrenceEncoder)\n  B: wrapped encoder where every embedding is per-concept dimension-shuffled\n    (each concept's 300-dim vector has its dimensions permuted by a hash-\n    seeded RNG; preserves unit-vector validity, scrambles geometry).\nPer-prompt: capture halt mode, walk (concept set + order), \u03a6, n_zetetic.\nCompute halt-mode agreement rate, walk Jaccard, \u03a6 delta, walk length delta.",
    "threshold": {
      "metric": "walk_jaccard_mean_indicating_concept_set_driven_stratum",
      "comparator": ">",
      "value": 0.3,
      "units": "jaccard"
    },
    "h0": "M.53 M2 strong version: encoder swap collapses reasoning (Jaccard ~ 0.0-0.3)",
    "h1": "M.53 M2 partial: encoder swap perturbs but does not collapse (Jaccard > 0.3)"
  },
  "preregistration": {
    "config_hash": "m56_5bfd7da7_p1_encoder_lever_partial_refutation_m53_m2",
    "data_hash": "m56_v1_encoder_pivot_ab_test",
    "analysis_plan": "Per-concept dimension-shuffled encoder A/B comparison; measure halt-mode agreement + walk Jaccard + \u03a6 delta + zetetic delta.",
    "sweep_grid": {
      "n_prompts": 15,
      "encoder_A": "KimeraCooccurrenceEncoder",
      "encoder_B": "NegatedEncoder(per_concept_dimension_shuffle)"
    },
    "preregistered_at": "2026-05-31T12:39:03.272252+00:00"
  },
  "data": {
    "substrate_name": "kimera-swm",
    "substrate_git_commit": "5bfd7da734a58bd68097aec4465572727b1318f0",
    "datasets": [
      {
        "name": "kimera_m56_encoder_ab_smoke_battery",
        "content_hash": "m56_v1_encoder_pivot_ab_test",
        "n_records": 15,
        "source": "kimera-swm-m56",
        "kind": "encoder_pivot_ab_test"
      }
    ]
  },
  "evidence": [
    {
      "pillar": "halt_mode_agreement",
      "statistic_name": "fraction",
      "statistic_value": 0.8,
      "library": "kimera-swm-m56",
      "library_version": "2026-05-31",
      "effect_size": null,
      "ci_low": null,
      "ci_high": null,
      "p_value": null,
      "cross_check": "passed",
      "detail": {
        "n_match": 12,
        "n_total": 15,
        "interpretation": "80% of prompts halt the same way under encoder swap \u2014 strong preservation"
      }
    },
    {
      "pillar": "walk_jaccard",
      "statistic_name": "mean",
      "statistic_value": 0.731,
      "library": "kimera-swm-m56",
      "library_version": "2026-05-31",
      "effect_size": null,
      "ci_low": null,
      "ci_high": null,
      "p_value": null,
      "cross_check": "passed",
      "detail": {
        "mean": 0.731,
        "median": 0.818,
        "interpretation": "average 73% concept-overlap between A and B walks"
      }
    },
    {
      "pillar": "phi_divergence",
      "statistic_name": "delta_mean",
      "statistic_value": 0.068,
      "library": "kimera-swm-m56",
      "library_version": "2026-05-31",
      "effect_size": null,
      "ci_low": null,
      "ci_high": null,
      "p_value": null,
      "cross_check": "passed",
      "detail": {
        "delta_mean": 0.068,
        "delta_max": 0.127,
        "M46_F3_baseline_noise": 0.01,
        "interpretation": "7\u00d7 baseline noise \u2014 real signal, but small absolute magnitude"
      }
    },
    {
      "pillar": "walk_length_delta",
      "statistic_name": "mean_abs_delta",
      "statistic_value": 1.6,
      "library": "kimera-swm-m56",
      "library_version": "2026-05-31",
      "effect_size": null,
      "ci_low": null,
      "ci_high": null,
      "p_value": null,
      "cross_check": "passed",
      "detail": {
        "interpretation": "average walk-length change of 1.6 concepts \u2014 small"
      }
    },
    {
      "pillar": "zetetic_divergence",
      "statistic_name": "delta_mean",
      "statistic_value": 12.7,
      "library": "kimera-swm-m56",
      "library_version": "2026-05-31",
      "effect_size": null,
      "ci_low": null,
      "ci_high": null,
      "p_value": null,
      "cross_check": "passed",
      "detail": {
        "interpretation": "zetetic firing pattern diverges substantially \u2014 consistent with encoder being load-bearing for embedding-pair detection (the zetetic mechanism)"
      }
    },
    {
      "pillar": "concept_set_driven_stratum_exists",
      "statistic_name": "evidence_strength",
      "statistic_value": 1.0,
      "library": "kimera-swm-m56",
      "library_version": "2026-05-31",
      "effect_size": null,
      "ci_low": null,
      "ci_high": null,
      "p_value": null,
      "cross_check": "passed",
      "detail": {
        "hypothesis": "Walker step-0 rule (M.46 F1') + concept extraction operate on token strings, encoder-independent; this stratum survives encoder perturbations"
      }
    }
  ],
  "verdict": {
    "outcome": "VALIDATED",
    "observed_value": 0.731,
    "threshold": {
      "metric": "walk_jaccard_mean_indicating_concept_set_driven_stratum",
      "comparator": ">",
      "value": 0.3,
      "units": "jaccard"
    },
    "reasoning": "Observed walk Jaccard mean 0.731 (median 0.818) \u2014 substantially > 0.30 floor. Halt-mode agreement 80% (12/15 prompts halt the same way). Phi delta mean 0.068 \u2014 7\u00d7 the M.46 F3 baseline noise (0.01) so this IS signal, but absolute value still small (max 0.127). The substrate's reasoning has a layer that operates on CONCEPT IDENTITIES (not encoder embeddings) and that layer survives encoder perturbations. The encoder DOES affect reasoning (n_zetetic delta mean 12.7 is large; phi changes 7\u00d7 baseline) but it's not the all-determining lever M.53 M2 described."
  },
  "reproduction": {
    "command": ".venv/bin/python experiments/observatory/runs/M56_encoder_pivot_ab_test_20260531/sign.py",
    "environment": {
      "venv": "kimera-swm/.venv",
      "git_commit": "5bfd7da734a58bd68097aec4465572727b1318f0"
    },
    "lineage_chain": []
  },
  "provenance": {},
  "signature": ""
}