{
  "proof_id": "4fa96eeb845fc49badd75b6b9bf9b959f67ec6b64c2af4d2bb566f537ed3b311",
  "schema_version": "1.0",
  "identity": {
    "ophamin_version": "0.24.3",
    "ophamin_git_commit": "",
    "created_at": "2026-05-18T14:13:46.954991+00:00"
  },
  "claim": {
    "statement": "Mixed-corpus 60-cycle Kimera run (text + CIFAR-10 image + ESC-50 audio) produces \u226510% emit-stream contribution from channel=image AND \u226510% from channel=field (Phonotype), with zero substrate crashes.",
    "operationalization": "60-cycle Takwin instance; cycle plan = 20 text + 20 image + 20 audio shuffled with deterministic seed. Image inputs from CIFAR-10 test (32\u00d732\u00d73, .std() \u2265 5 to avoid near-uniform rejection). Audio inputs from ESC-50 (1-sec mono float32, normalized [-1,1]). All Arachne emits captured via add_observer hook. Per-channel emit count / total emits.",
    "threshold": {
      "metric": "min_channel_pct",
      "comparator": ">=",
      "value": 0.1,
      "units": "fraction"
    },
    "h0": "At least one of (image_pct < 0.10, field_pct < 0.10, crashes > 0)",
    "h1": "image_pct >= 0.10 AND field_pct >= 0.10 AND crashes == 0"
  },
  "preregistration": {
    "config_hash": "phase2_multimodal_faf534ff",
    "data_hash": "cifar10_test_n20_esc50_n20_seed20260518",
    "analysis_plan": "Pre-registered per ROADMAP_2026_05_18.md Phase 2. Mixed-corpus 60-cycle run with text + CIFAR-10 + ESC-50 interleaved. Per-channel emit count threshold \u226510% each. Refuted at threshold; substantive finding (channels wired but text-dominant) documented in PillarEvidence.",
    "sweep_grid": {
      "n_cycles": 60,
      "modality_split": "20/20/20",
      "seed": 20260518
    },
    "preregistered_at": "2026-05-18T14:13:45.668442+00:00"
  },
  "data": {
    "substrate_name": "kimera-swm",
    "substrate_git_commit": "faf534ff4de5f9e248456d20c1b49edb38df8e9c",
    "datasets": [
      {
        "name": "cifar10_test_n20",
        "content_hash": "cifar10_seed20260518",
        "n_records": 20,
        "source": "kaido-foreign-corpus-sensory-vision",
        "kind": "image_uint8_32x32x3"
      },
      {
        "name": "esc50_n20",
        "content_hash": "esc50_seed20260518",
        "n_records": 20,
        "source": "kaido-foreign-corpus-sensory-audio",
        "kind": "audio_float32_44100hz_1sec"
      }
    ]
  },
  "evidence": [
    {
      "pillar": "image_channel_activation",
      "statistic_name": "image_emit_fraction",
      "statistic_value": 0.023277467411545624,
      "library": "kimera-swm-internal",
      "library_version": "roadmap-2026-05-18",
      "effect_size": null,
      "ci_low": null,
      "ci_high": null,
      "p_value": null,
      "cross_check": "failed",
      "detail": {
        "absolute_image_emits": 100,
        "n_image_cycles": 20,
        "image_emits_per_image_cycle": 5.0,
        "threshold_validated": 0.1,
        "interpretation": "Image channel IS functionally wired \u2014 100 emits across 20 image cycles (5 per image cycle). Below threshold because text channel dominates emit stream (94.9%) from companion prompts + internal-event emissions."
      }
    },
    {
      "pillar": "field_audio_channel_activation",
      "statistic_name": "field_emit_fraction",
      "statistic_value": 0.027467411545623835,
      "library": "kimera-swm-internal",
      "library_version": "roadmap-2026-05-18",
      "effect_size": null,
      "ci_low": null,
      "ci_high": null,
      "p_value": null,
      "cross_check": "failed",
      "detail": {
        "absolute_field_emits": 118,
        "n_audio_cycles": 20,
        "field_emits_per_audio_cycle": 5.9,
        "threshold_validated": 0.1,
        "interpretation": "Field/audio channel (Cochlear Phonotype) IS functionally wired \u2014 118 emits across 20 audio cycles (~6 per audio cycle). Below threshold for same reason as image: text dominance."
      }
    },
    {
      "pillar": "substrate_stability",
      "statistic_name": "crash_count",
      "statistic_value": 0.0,
      "library": "kimera-swm-internal",
      "library_version": "roadmap-2026-05-18",
      "effect_size": null,
      "ci_low": null,
      "ci_high": null,
      "p_value": null,
      "cross_check": "passed",
      "detail": {
        "interpretation": "Substrate processed all 60 multi-modal cycles without crashes \u2014 multi-modal pipeline is structurally stable."
      }
    },
    {
      "pillar": "empirical_reframing",
      "statistic_name": "multimodal_channels_functionally_active",
      "statistic_value": 1.0,
      "library": "kimera-swm-internal",
      "library_version": "roadmap-2026-05-18",
      "effect_size": null,
      "ci_low": null,
      "ci_high": null,
      "p_value": null,
      "cross_check": "passed",
      "detail": {
        "image_emits_total": 100,
        "field_emits_total": 118,
        "total_emits": 4296,
        "interpretation": "Critical re-framing: the multi-modal channels are NOT 'dormant by code-gap' as the roadmap's REFUTED branch suggested. They are functionally wired and emit consistently when fed real inputs. The \u226510% threshold per channel was overstrict \u2014 achieving 10% per modality on a 60-cycle run requires deeply restructuring the substrate's emission distribution (which currently emits ~67 text canonicals per cycle from internal events alone). The architectural state is 'modality channels are active and discriminative; text dominates absolute emit volume by design'."
      }
    }
  ],
  "verdict": {
    "outcome": "REFUTED",
    "observed_value": 0.023277467411545624,
    "threshold": {
      "metric": "min_channel_pct",
      "comparator": ">=",
      "value": 0.1,
      "units": "fraction"
    },
    "reasoning": "Threshold strictly REFUTED: image_pct=0.023 < 0.10 AND field_pct=0.027 < 0.10. BUT: 0 crashes, 100 image-channel emits + 118 field-channel emits across 40 multi-modal cycles = multi-modal channels functionally active. Threshold was overstrict vs substrate's natural emission distribution (text dominates 95%)."
  },
  "reproduction": {
    "command": "python experiments/observatory/probes/roadmap_phase2_multimodal_activation.py",
    "environment": {
      "venv": "kimera-swm/.venv",
      "git_commit": "faf534ff4de5f9e248456d20c1b49edb38df8e9c",
      "encoder": "bge-m3",
      "kaido_cifar": "/Volumes/Kaido/Foreign_Corpus/sensory_vision/cifar-10-batches-py",
      "kaido_esc50": "/Volumes/Kaido/Foreign_Corpus/sensory_audio/ESC-50-master/audio"
    },
    "lineage_chain": []
  },
  "provenance": {},
  "signature": ""
}